{
  "schemaVersion": 1,
  "id": "app.fuyo.luan.official",
  "name": "Luan Sounds",
  "description": "Procedurally synthesized sound packs made for Luan, ready to preview and use in the app.",
  "localizations": {
    "zh-Hans": {
      "name": "Luan 音效",
      "description": "为 Luan 制作的程序合成音效包，可在 App 中直接试听和选用。"
    },
    "zh-Hant": {
      "name": "Luan 音效",
      "description": "專為 Luan 製作、以程式合成的音效包，可在 App 中直接試聽與選用。"
    }
  },
  "author": {
    "name": "Luan",
    "email": "luan@fuyo.app",
    "url": "https://luan.fuyo.app"
  },
  "homepage": "https://github.com/onepiece-studio/luan-sounds",
  "packs": [
    {
      "id": "analog",
      "name": "Analog",
      "description": "Warm, full synth phrases with subtle natural movement.",
      "localizations": {
        "zh-Hans": {
          "name": "模拟",
          "description": "温暖厚实的合成器短句，带细微的自然起伏。"
        },
        "zh-Hant": {
          "name": "類比",
          "description": "溫暖厚實的合成器短句，帶細微的自然起伏。"
        }
      },
      "version": 4,
      "license": "LicenseRef-Luan-Official",
      "sounds": {
        "session-start": {
          "file": "assets/db48aeaf174f1f6299b1127def970d4ebe82700d9e0b7eccd9ae71f0359c76d7.wav",
          "sha256": "db48aeaf174f1f6299b1127def970d4ebe82700d9e0b7eccd9ae71f0359c76d7",
          "size": 46124
        },
        "task-acknowledge": {
          "file": "assets/196964c3fc7d195b203e52a7c7e70b7423e0620ad6c222d16cd257d5b2ab7915.wav",
          "sha256": "196964c3fc7d195b203e52a7c7e70b7423e0620ad6c222d16cd257d5b2ab7915",
          "size": 22124
        },
        "task-complete": {
          "file": "assets/c4f3ac5420a85b3fb8933327fc2736f17c6a6d8f79635f50020ff089dddf11ef.wav",
          "sha256": "c4f3ac5420a85b3fb8933327fc2736f17c6a6d8f79635f50020ff089dddf11ef",
          "size": 57644
        },
        "task-error": {
          "file": "assets/591bb3ef2b73bce051ed024427990b704b4b89e4c5b47f92f3256f8453ba8056.wav",
          "sha256": "591bb3ef2b73bce051ed024427990b704b4b89e4c5b47f92f3256f8453ba8056",
          "size": 41324
        },
        "input-required": {
          "file": "assets/2896c6314382293696f04171da204c39804ba87f181770a9925b0a455851e564.wav",
          "sha256": "2896c6314382293696f04171da204c39804ba87f181770a9925b0a455851e564",
          "size": 45164
        },
        "input-required-question": {
          "file": "assets/6b87fe9c263f29732bef079d859b7b44b4513520560820d050c05c3b349d026a.wav",
          "sha256": "6b87fe9c263f29732bef079d859b7b44b4513520560820d050c05c3b349d026a",
          "size": 52844
        },
        "resource-limit": {
          "file": "assets/f81cfbe0a5d6de4cb05565778c2dcc94320d6f87c18e55d89d65a3814679096e.wav",
          "sha256": "f81cfbe0a5d6de4cb05565778c2dcc94320d6f87c18e55d89d65a3814679096e",
          "size": 46124
        },
        "user-spam": {
          "file": "assets/143242be5ed5f20b620829472a7fb1ee0ababcb04443f6aee2b7c944a0dc19f2.wav",
          "sha256": "143242be5ed5f20b620829472a7fb1ee0ababcb04443f6aee2b7c944a0dc19f2",
          "size": 27884
        },
        "idle-reminder": {
          "file": "assets/f51b547d2237011d8461b22fab1fd186aa9dc247071309d7fc82dfaae0f55fb0.wav",
          "sha256": "f51b547d2237011d8461b22fab1fd186aa9dc247071309d7fc82dfaae0f55fb0",
          "size": 57644
        },
        "compaction-complete": {
          "file": "assets/0bbb687900ae472bf94285360e8095dbcf0184f4f63b51e377b6aef9c89bc4b6.wav",
          "sha256": "0bbb687900ae472bf94285360e8095dbcf0184f4f63b51e377b6aef9c89bc4b6",
          "size": 61100
        }
      }
    },
    {
      "id": "blackbird",
      "name": "Blackbird flute",
      "description": "Original synthesized birdsong: flowing, flute-like glides and irregular phrases evoking a blackbird.",
      "localizations": {
        "zh-Hans": {
          "name": "乌鸫·笛语",
          "description": "原创合成仿鸟鸣：流动的笛质滑音与不规则短句，取乌鸫式歌声意象。"
        },
        "zh-Hant": {
          "name": "烏鶇·笛語",
          "description": "原創合成仿鳥鳴：流動的笛質滑音與不規則短句，取烏鶇式歌聲意象。"
        }
      },
      "version": 4,
      "license": "LicenseRef-Luan-Official",
      "sounds": {
        "session-start": {
          "file": "assets/5d5f647e93748f80486b827c3396af193f4ddcbafd4039b0ce0cb1e39cc459d4.wav",
          "sha256": "5d5f647e93748f80486b827c3396af193f4ddcbafd4039b0ce0cb1e39cc459d4",
          "size": 58892
        },
        "task-acknowledge": {
          "file": "assets/e220fb7559678a051e4c1467bd80ea311b8cf5a99c72e42eef9138cf839b8309.wav",
          "sha256": "e220fb7559678a051e4c1467bd80ea311b8cf5a99c72e42eef9138cf839b8309",
          "size": 28652
        },
        "task-complete": {
          "file": "assets/7f7e01f63875e78b412b871f1d009f295f15d7829eb792aac7284aa7ce13b4e7.wav",
          "sha256": "7f7e01f63875e78b412b871f1d009f295f15d7829eb792aac7284aa7ce13b4e7",
          "size": 81452
        },
        "task-error": {
          "file": "assets/b1099fbb29d1a08f5aa3deddf9fdb021973771e45b31bed46d0ef81a8b846a93.wav",
          "sha256": "b1099fbb29d1a08f5aa3deddf9fdb021973771e45b31bed46d0ef81a8b846a93",
          "size": 50732
        },
        "input-required": {
          "file": "assets/898987b05908c9cc1fd957e0ebcc00826f53a72b638017c1d0881794611cacc4.wav",
          "sha256": "898987b05908c9cc1fd957e0ebcc00826f53a72b638017c1d0881794611cacc4",
          "size": 60332
        },
        "input-required-question": {
          "file": "assets/585b04ac2e78a978a10a558816eb1cc3cbab8dc01925018ba85535b730e9713d.wav",
          "sha256": "585b04ac2e78a978a10a558816eb1cc3cbab8dc01925018ba85535b730e9713d",
          "size": 56492
        },
        "resource-limit": {
          "file": "assets/9877755d0d2312df15cc8af4b5034ee22b4ebc86a0bd56b57449f033a2247385.wav",
          "sha256": "9877755d0d2312df15cc8af4b5034ee22b4ebc86a0bd56b57449f033a2247385",
          "size": 60332
        },
        "user-spam": {
          "file": "assets/16f567fc4864034e13e7c967a4500cef267baa9a2d042045f359456d7ce7e21c.wav",
          "sha256": "16f567fc4864034e13e7c967a4500cef267baa9a2d042045f359456d7ce7e21c",
          "size": 47852
        },
        "idle-reminder": {
          "file": "assets/efaf5432d6c15c7f365cef2271b1f637289fbc134f5f9c5925582e22a7c054ed.wav",
          "sha256": "efaf5432d6c15c7f365cef2271b1f637289fbc134f5f9c5925582e22a7c054ed",
          "size": 43052
        },
        "compaction-complete": {
          "file": "assets/ab3ad7bcbd8c362c09026c979fd7403cc400a67a76b03220289d70ea24e49c23.wav",
          "sha256": "ab3ad7bcbd8c362c09026c979fd7403cc400a67a76b03220289d70ea24e49c23",
          "size": 60332
        }
      }
    },
    {
      "id": "breath",
      "name": "Breeze",
      "description": "Rounded airflow and soft whistle tones that rise and fall.",
      "localizations": {
        "zh-Hans": {
          "name": "微风",
          "description": "圆润气流与轻哨管的起落。"
        },
        "zh-Hant": {
          "name": "微風",
          "description": "圓潤氣流與輕哨管的起落。"
        }
      },
      "version": 4,
      "license": "LicenseRef-Luan-Official",
      "sounds": {
        "session-start": {
          "file": "assets/fe2f1e53a46b7ae6fddcd8c2fef2fc3c2cb02e507a58b42f1055a369e3b94a16.wav",
          "sha256": "fe2f1e53a46b7ae6fddcd8c2fef2fc3c2cb02e507a58b42f1055a369e3b94a16",
          "size": 50924
        },
        "task-acknowledge": {
          "file": "assets/080961ccf71d3df7b1a6e74edef8bf48faadca2e38747a9e3ac450909e169cc6.wav",
          "sha256": "080961ccf71d3df7b1a6e74edef8bf48faadca2e38747a9e3ac450909e169cc6",
          "size": 17324
        },
        "task-complete": {
          "file": "assets/87116e582fcfef0a9bf07d40f415e5e1a674a403da23ffd97f7a2fec09f0a271.wav",
          "sha256": "87116e582fcfef0a9bf07d40f415e5e1a674a403da23ffd97f7a2fec09f0a271",
          "size": 62444
        },
        "task-error": {
          "file": "assets/12c717d4aabeb96f8801c178581cf32db80e2c76780274ca90e353bd8d1ae153.wav",
          "sha256": "12c717d4aabeb96f8801c178581cf32db80e2c76780274ca90e353bd8d1ae153",
          "size": 35564
        },
        "input-required": {
          "file": "assets/d189f8c35eecc0ec57aa28d0308cbc3d41602a11928046afa34415a0e57393d1.wav",
          "sha256": "d189f8c35eecc0ec57aa28d0308cbc3d41602a11928046afa34415a0e57393d1",
          "size": 45164
        },
        "input-required-question": {
          "file": "assets/b4f5aa702a28679307dfefd6b4c22be13ef68c3661d636c2f99db9cc3a6e8e0c.wav",
          "sha256": "b4f5aa702a28679307dfefd6b4c22be13ef68c3661d636c2f99db9cc3a6e8e0c",
          "size": 52844
        },
        "resource-limit": {
          "file": "assets/119d9c630ee102a2ecff0cd3547348c9f59393b59fc838156e4271fb547a7e8c.wav",
          "sha256": "119d9c630ee102a2ecff0cd3547348c9f59393b59fc838156e4271fb547a7e8c",
          "size": 39404
        },
        "user-spam": {
          "file": "assets/f5ff2af4db39d04dd67091e442d9e7584d918aed7247743e0908f00f97b4ec42.wav",
          "sha256": "f5ff2af4db39d04dd67091e442d9e7584d918aed7247743e0908f00f97b4ec42",
          "size": 22124
        },
        "idle-reminder": {
          "file": "assets/e4ace6e798402b013da7d09c3c4654820914620214fe1a12f6add5df46f56eeb.wav",
          "sha256": "e4ace6e798402b013da7d09c3c4654820914620214fe1a12f6add5df46f56eeb",
          "size": 64364
        },
        "compaction-complete": {
          "file": "assets/9fc1734c21a76fce0fc50291f9b5808d2dc093045fcbf391e35845f8faeced0d.wav",
          "sha256": "9fc1734c21a76fce0fc50291f9b5808d2dc093045fcbf391e35845f8faeced0d",
          "size": 49868
        }
      }
    },
    {
      "id": "clockwork",
      "name": "Clockwork",
      "description": "Restrained escapement ticks, winding and light spring sounds.",
      "localizations": {
        "zh-Hans": {
          "name": "钟表",
          "description": "克制的擒纵滴答、上弦与弹簧轻响。"
        },
        "zh-Hant": {
          "name": "鐘錶",
          "description": "克制的擒縱滴答、上弦與彈簧輕響。"
        }
      },
      "version": 4,
      "license": "LicenseRef-Luan-Official",